{
  "schemaVersion": "1.0.0",
  "assetId": "future_courtyard",
  "checkpointId": "future_courtyard_v004_export",
  "source": {
    "brief": "assets/briefs/future_courtyard.brief.json",
    "briefSha256": "8d4ea10cd5a8e252876e5ed85c9a8d1e794e1fd9b329279902ccf468618b8bc5",
    "stageScript": "blender/scripts/build_future_courtyard.py",
    "stageScriptSha256": "ad4ece1ac64b875ebe6973b53b7f5091f3ed0d1ef13a2180931ec9f508a772fe",
    "seed": 42
  },
  "runtime": {
    "format": "glTF 2.0 GLB",
    "metersPerUnit": 1,
    "upAxis": "Y",
    "assets": {
      "environment": {
        "bytes": 387172,
        "sha256": "6db60185edab993f8a0ce4d286753a70eb4d4eec69bde8929cfa2bb805e27f90",
        "nodes": [
          "COL_Fountain-colonly",
          "COL_WallEast-colonly",
          "COL_WallNorth-colonly",
          "COL_WallSouthLeft-colonly",
          "COL_WallSouthRight-colonly",
          "COL_WallWest-colonly",
          "ENV_CentralWalkway",
          "ENV_Ground",
          "KIT_Canopy_Roof",
          "KIT_Canopy_Support_+1.75",
          "KIT_Canopy_Support_-1.75",
          "KIT_Canopy_4x4",
          "KIT_Pillar_0p5x3_+10_+10",
          "KIT_Pillar_0p5x3_+10_-10",
          "KIT_Pillar_0p5x3_-10_+10",
          "KIT_Pillar_0p5x3_-10_-10",
          "KIT_WallDoor_Left",
          "KIT_WallDoor_Lintel",
          "KIT_WallDoor_Right",
          "KIT_WallDoor_4x3",
          "KIT_WallSolid_E_+0",
          "KIT_WallSolid_E_+4",
          "KIT_WallSolid_E_+8",
          "KIT_WallSolid_E_-4",
          "KIT_WallSolid_E_-8",
          "KIT_WallSolid_N_+4",
          "KIT_WallSolid_N_+8",
          "KIT_WallSolid_N_-4",
          "KIT_WallSolid_N_-8",
          "KIT_WallSolid_S_+4",
          "KIT_WallSolid_S_+8",
          "KIT_WallSolid_S_-4",
          "KIT_WallSolid_S_-8",
          "KIT_WallSolid_W_+0",
          "KIT_WallSolid_W_+4",
          "KIT_WallSolid_W_+8",
          "KIT_WallSolid_W_-4",
          "KIT_WallSolid_W_-8",
          "KIT_WallWindow_Left",
          "KIT_WallWindow_Lintel",
          "KIT_WallWindow_Right",
          "KIT_WallWindow_Sill",
          "KIT_WindowGlass",
          "KIT_WallWindow_4x3",
          "NAV_Courtyard-navmesh",
          "PROP_Barrier_Beam",
          "PROP_Barrier_Post_+1.1",
          "PROP_Barrier_Post_-1.1",
          "PROP_Barrier",
          "PROP_Bench_Back",
          "PROP_Bench_Leg_-3.2",
          "PROP_Bench_Leg_-4.8",
          "PROP_Bench_Seat",
          "PROP_Bench",
          "PROP_Bollard_Body",
          "PROP_Bollard_Glow",
          "PROP_BollardLight",
          "PROP_Crate_BandX",
          "PROP_Crate_BandY",
          "PROP_Crate_Box",
          "PROP_Crate",
          "PROP_DronePad_Base",
          "PROP_DronePad_H",
          "PROP_DronePad_H2",
          "PROP_DronePad_Ring",
          "PROP_DronePad",
          "PROP_Fountain_Base",
          "PROP_Fountain_Core",
          "PROP_Fountain_Water",
          "PROP_Fountain",
          "PROP_HoloTerminal_Base",
          "PROP_HoloTerminal_Screen",
          "PROP_HoloTerminal",
          "PROP_Planter_Box",
          "PROP_Planter_Soil",
          "PROP_Planter",
          "PROP_StreetLamp_Head",
          "PROP_StreetLamp_Pole",
          "PROP_StreetLamp",
          "PROP_Tree_CrownHigh",
          "PROP_Tree_CrownLow",
          "PROP_Tree_Trunk",
          "PROP_Tree",
          "ENV_FutureCourtyard"
        ],
        "animations": [],
        "materials": [
          "MAT_Accent",
          "MAT_Ground",
          "MAT_Wall",
          "MAT_Metal",
          "MAT_Emission",
          "MAT_Foliage"
        ],
        "textures": 0,
        "images": 0,
        "triangles": 5236,
        "externalUris": [],
        "path": "assets/runtime/future_courtyard_environment.glb"
      },
      "character": {
        "bytes": 130128,
        "sha256": "28e383007f8aed03b409bd48a7c99495c52b9757a3522ad96cffc9d388697a73",
        "nodes": [
          "CHR_FootL",
          "Foot.L",
          "CHR_LegL",
          "Leg.L",
          "CHR_FootR",
          "Foot.R",
          "CHR_LegR",
          "Leg.R",
          "CHR_Head",
          "CHR_Visor",
          "Head",
          "CHR_ForearmL",
          "Forearm.L",
          "CHR_UpperArmL",
          "UpperArm.L",
          "CHR_ForearmR",
          "Forearm.R",
          "CHR_UpperArmR",
          "UpperArm.R",
          "CHR_ChestAccent",
          "CHR_Torso",
          "Spine",
          "Root",
          "RIG_Player",
          "CHR_Player"
        ],
        "animations": [
          "Idle_loop",
          "Jump",
          "Run_loop",
          "Walk_loop"
        ],
        "materials": [
          "MAT_Player",
          "MAT_Metal",
          "MAT_Emission",
          "MAT_Accent"
        ],
        "textures": 0,
        "images": 0,
        "triangles": 1296,
        "externalUris": [],
        "path": "assets/runtime/future_courtyard_character.glb"
      }
    }
  },
  "toolchain": {
    "blender": "5.2.1 LTS",
    "validator": "ai3d-glb-validator/1.0.0"
  },
  "contents": {
    "modules": [
      "KIT_WallSolid_4x3",
      "KIT_WallDoor_4x3",
      "KIT_WallWindow_4x3",
      "KIT_Pillar_0p5x3",
      "KIT_Canopy_4x4"
    ],
    "props": [
      "PROP_Bench",
      "PROP_Planter",
      "PROP_Tree",
      "PROP_BollardLight",
      "PROP_StreetLamp",
      "PROP_HoloTerminal",
      "PROP_Crate",
      "PROP_Barrier",
      "PROP_Fountain",
      "PROP_DronePad"
    ],
    "materials": [
      "MAT_Accent",
      "MAT_Emission",
      "MAT_Foliage",
      "MAT_Ground",
      "MAT_Metal",
      "MAT_Player",
      "MAT_Wall"
    ],
    "animations": [
      "Idle_loop",
      "Jump",
      "Run_loop",
      "Walk_loop"
    ]
  },
  "metrics": {
    "bytes": 517300,
    "triangles": 6532,
    "materials": 7,
    "textures": 0,
    "bones": 11,
    "environmentBoundsM": [
      24.0,
      24.0,
      4.55
    ]
  },
  "provenance": {
    "kind": "deterministic-procedural",
    "prompt": "low-poly future courtyard",
    "seed": 42,
    "thirdParty": []
  },
  "validation": {
    "publicReport": "docs/validation/canonical-glb.json",
    "nativeConsistency": "docs/validation/native-consistency.json",
    "fullProductionG0G7": "not executed or claimed in public migration"
  }
}